tweet,retweetsCount,favoritesCount
"Astronaut Sally Ride was a pathfinder, a leader, and an icon we all looked up to in the corps. Image gallery &amp; video: http://t.co/gsfKqzjP .",47,8
"RT @TheRealBuzz: So sorry to hear of the loss of my friend and fellow astronaut Sally Ride. You will always be an inspiration for women  ...",962,0
"The hike back was extremely challenging - taxing us emotionally and physically. A memory that will never be forgotten. http://t.co/npXHHjpX",11,6
"Mark Kelly removes his crampons after 1st half of exhilarating hike. At refuge we eat, install the plaque, hike back! http://t.co/1aJ9MTgF",0,0
"View looking back after 150 meters - we entered the ice on this ridge line - dramatic 400m drops inches from our feet. http://t.co/H9IHh3aZ",10,8
"Mark, Roberto, and I, together with spouses &amp; guides, w crampons, roped ourselves together &amp; made a challenging hike. http://t.co/7IjMHFgY",3,2
"Arrival in Geneva. STS 134 crew ex for Roberto, who is arriving later today. We're meeting with folks at CERN to start. http://t.co/0WHlSsRN",14,4
"Lunch was hosted by Karen, the current owner of Neil Armstrong's boyhood home, at 601 West Benton Street. http://t.co/R3QYnNtl",6,5
"I'm in Wapakoneta this weekend helping the Armstrong Museum celebrate the anniversary of man's first step on the moon. http://t.co/e2uk6Vbt",19,13
"The GCP young professionals group (social media advisory committee) is meeting our leaders/developing profs and learning more about Glenn.",4,0
"Our Developing Professionals Club at NASA Glenn is hosting a 9 Aug visit by young prof club from the Greater Cleveland Partnership. Win Win!",4,3
"RT @dpcnasa: @Astro_Box @NASAglenn @BeThePlus #SMAC at NASA Glenn on August 9th 2012!",4,0
"Posing with Jim Converse, a crewmember on Intrepid's last cruise. I shared my experience as Endeavour's last PLT. Wow! http://t.co/FxfuGDPf",3,1
"My new friends: EA-18G drivers at Dayton AIr Show. LT FOJACS Simms, LT Boy George, LTJG Webelo Marucci, LTJG UDA Worst. http://t.co/bjzQ1zQq",6,3
"Pictured next to Major 'Howler' Wehle, weapon systems officer of this F-15E. Our NASA team shares exhibit area closeby. http://t.co/PJQApWNx",2,2
"Dayton Air Show - birthplace of aviation, next to an F-15E. I logged some hours in this fine machine in the early 90s. http://t.co/cKg9Tm8G",11,0
"Spending the weekend in Ohio at the Dayton Air Show.  At the parade last night we exchanged momentos w local officials. http://t.co/PB85WQBV",5,2
