tweet,retweetsCount,favoritesCount
"RT @NASA_Johnson: #Exp40 poses inside #ISS Harmony node. http://t.co/AqA5ShsTag http://t.co/iq1yQydIr0",110,0
"Побалую вас видами космоса #SurMax http://t.co/yLynqhyjQL",136,175
"Ну вот еще кое-что интересное #SurMax http://t.co/G4ParBLY4D",164,180
"Космические пейзажи МКС #SurMax http://t.co/0maI18O12i",108,132
"А вот наш красавец Союз. Самая надежная машина в мире. Будет все время с нами и в ноябре вернёт нас обратно на землю. http://t.co/S2aJqwJpPO",241,161
"Вот вам очередной фотофакт космической действительности http://t.co/7DIUOxOe0r",148,135
"Вот вам очередной фотофакт космической действительности http://t.co/qQSYEiIsXX",88,82
"Еще мы здесь ставим эксперименты над людьми :) #SurMax  http://t.co/4sXsNB2HIa с помощью @YouTube",28,28
"На борту космической станции есть свои архивы #SurMax Вот кое-что из них:) http://t.co/YJqn9M6c7U с помощью @YouTube",35,38
"вот вам еще одно мгновение #SurMax http://t.co/leGFogs1NB",147,152
"А теперь начинаю публиковать фотофиксацию действительности без фотошопа #SurMax http://t.co/PF9knUxm1t",371,311
"Мое обращение к коллегам из #ОПМО #SurMax: http://t.co/vz48eXEdbn с помощью @YouTube",12,11
"Снег среди лета http://t.co/HiUdSL4fs5 с помощью @YouTube",29,24
"Олег @OlegMKS работает с научной аппаратурой «Спектрометр» которую мы используем для изучения  Земли. http://t.co/aSKIOzmbQk",22,34
"Но перед серией фото немного моей реальности #SurMax http://t.co/crpKsCcHJc.",51,38
"Начинаю публикацию снимков которые мне удалось сделать на МКС. Думаю, может быть интересно будет посмотреть. Всё живое никакого монтажа.",41,22
"Всем доброе, дорогие друзья! Долго не писал. Было много работы. Вот кое-что из этого #SurMax  http://t.co/DEQRRp5h5m с помощью @YouTube",46,26
"Некотрые размышления : http://t.co/fwV24tLy5c с помощью @YouTube #SurMax",32,23
"RT @amicableru: ВАЖНО: Губернаторская премия #НашеПодмосковье – новый призыв http://t.co/nRRC3K22d5 #ПремияГубернатора @nashepodmoskove  Уч…",20,0
"Продолжая тему космического здоровья и бодрости духа  http://t.co/AFed07amjU с помощью @YouTube Бодрое утро от #SurMax",20,22
"RT @OlegMKS: 27 июня День Молодежи в России #МКС см блог (June 27. Youth Day in Russia #ISS detail in blog) http://t.co/j9A1g98I2a http://t…",67,0
"RT @OlegMKS: Города России - Иркутск #МКС ещё см блог (Cities in Russia – Irkutsk #ISS HQ in blog) #BlueDot http://t.co/BPlRTatfKL http://t…",71,0
"ГРАНИЦА  #SurMax http://t.co/BOeCSueX0F",63,73
"тем временем за боротом #SurMax http://t.co/46fzuEdBnG",64,74
"Даже мы иногда удивлены как невесомость меняет наши лица #SurMax http://t.co/0yhTxKfcFQ",141,121
"Раз в неделю у нас есть видео связь с родными. Это мощнейшая психологическая поддержка http://t.co/6JLlgQyTNL с помощью @YouTube",27,24
"Да! Кстати! Удачи нашим футболистам в игре с Алжиром! #SurMax",28,11
"После длинного рабочего дня ничего лучше,чем повиснуть в спальном мешке на стене и улететь к Морфею до утра #SurMax http://t.co/v7wYD4GN6X",77,67
"Доброе утро, земляне! Иногда вместо зубной пасты мы используем естественные освежители полости рта #SurMax http://t.co/WknPeDsKiZ",155,88
"Продолжая тему физического здравия  http://t.co/7X6ccSJeL0 с помощью @YouTube #SurMax",27,28
"Слышал, что в Москве сегодня солнечно) ... Солнечное отражение на солнечных батареях #SurMax http://t.co/4UVJAvMmz2",44,48
"Олег @OlegMKS работает с научной аппаратурой «Спектрометр» которую мы используем для изучения  Земли http://t.co/2wKJ86gVoW",30,31
"Здоровье в порядке, спасибо зарядке! http://t.co/qw9sfXJHak с помощью @YouTube",42,36
"вечерний трафик на МКС:  http://t.co/gqrkCyQzPm с помощью @YouTube",45,36
"На Земле происходит что-то страшное. Бедные девочки https://t.co/kJ1YjNtVpD",67,11
"В процессе съёмки этого видео ни один астронавт не пострадал. Люди , большая просьба не относиться слишком серьёзно ко всем нашим видео.",14,17
"На сон грядущий. Эпизод 1 http://t.co/XWXax32Lc2 с помощью @YouTube",101,60
"RT @OlegMKS: Балаклава #Крым родной город @AntonAstrey (Balaklava #Crimea hometown @AntonAstrey ) #bluedot http://t.co/g0ZPnHekO5 http://t.…",142,0
"RT @OlegMKS: Анимация #ВКД-38 (eng) http://t.co/lDv32L2VmF http://t.co/mevHKaRwZL",12,0
"еще один кадр на сладкое http://t.co/NMwGIBPcfA",87,83
"http://t.co/h7JtX2fk2J",81,73
"Обещал - выполняю http://t.co/lfDxNai00H",54,55
"RT @Space_Lectures: #FF_Specialツ @OlegMKS @Msuraev @Astro_Alex '@astro_reid I will never tire of this view' Wish I was there with you :-) h…",36,0
"Сегодня выход в открытый космос. Все дни были заняты подготовкой. Скоро порадую какой-нибудь информацией)",31,30
"у нас вовсю идет подготовка к выходу в открытый космос: http://t.co/3PWFSQSJ2l с помощью @YouTube",47,33
"Исчезли не только волосы но и эмблема на футболке. Жертвой опыта стал @OlegMKS http://t.co/Ircb3iEo9G",78,42
"Недавно прислали комбайн для помывки, сушки и завивки волос. Что-то пошло не так или мы неправильно собрали схему. http://t.co/HOYX5qlxp2",144,78
"Удалось таки поучаствовать в первом пленарном заседании ОПРФ выйти на связь по телефону. Спасибо @Plesheva",15,6
"RT @Plesheva: Член ОПМО Максим @Msuraev примет участие в первой пленарке ОПРФ прямо из космоса #SurMax",9,0
"Тестирование подключения прошло успешно. Однако, сейчас из Центра управления полетами сообщили, что прямая связь с ОПРФ невозможна(",7,9
"Скоро сеанс прямой связи с Россией) Первое пленарное заседание Общественной палаты РФ  нового созыва. Меня туда делегировала ОПМО #SurMax",15,10
"Для тех, кто еще на выходных.. Одно из самых любимых мест отдыха наших туристов о.Кипр. Вот бы сейчас туда) Шутка http://t.co/QDI8bxk6Ru",117,116
"Тем временем настал момент ужина: http://t.co/QeqSqtHq1c с помощью @YouTube  по просьбе коллег с хештегом #SurMax",91,52
"RT @Astro_Alex: New horizons #BlueDot #blog http://t.co/1Z0TArwUtk http://t.co/FO42Xo9ZGA",169,0
"Все знают мультфильм Мадагаскар, а вот так выглядит остров Мадагаскар из космоса.На что еще вам  хотелось взглянуть? http://t.co/LKyprXsG5Z",226,135
"Гордимся ) http://t.co/esKLtkdiEq",87,52
"Всех поздравляю с праздником! Я люблю свою страну! Я её обажаю!!!!!!! http://t.co/6XtzxGROkl",51,49
"Пока вы отмечаете День России, мы вовсю готовимся  к выходу в открытый космос http://t.co/39ycBEsyEV с помощью @YouTube",69,29
"С днем России!!! Чтобы слава величала, а мощь росла!",111,19
"Не перестаю восхищаться как прекрасна наша планета Земля http://t.co/7cM5dY7xzx с помощью @YouTube",121,69
"Продолжая о погоде,Не знаю,что у вас за окном сейчас.А у нас небольшой ураган в тихом океане скрутил облака в спираль http://t.co/kI9LRBmtjN",240,141
"Так сверху выглядит фронт после прихода которого портится погода. Говорят, на Земле это сегодня актуально ) http://t.co/yJ1M1ASg4F",193,102
"Отстыкованный от МКС  'Прогресс М-21М' сведён с орбиты и закончил своё существование. Как это было http://t.co/NIE7DOUFdB с помощью @YouTube",46,37
"ПРОГРЕСС или куда девается космический  мусор  http://t.co/NcY5PTij5w с помощью @YouTube",64,38
"Видео: Очень сложно в невесомости правильно оттолкнуться http://t.co/XyKehoba0N с помощью @YouTube",87,54
"У ребят скоро выход о открытый космос. Подготовка к этому событию идет полным ходом. http://t.co/XKpJarpS4x",115,65
"Очень сложно в невесомости правильно оттолкнуться чтобы прилететь в заданное место и не сбить что-нибудь по дороге.",47,29
"Проба объектива http://t.co/6AsLm6humX",246,203
"RT @astro_reid: Finally! #SoyuzTMA13M selfie @astro_alex @msuraev http://t.co/mI8YkfcoWc",414,0
"селфи в космосе with  @OlegMKS http://t.co/GM3HGMLdgH",119,78
"Первый день. Открытие люка http://t.co/1AU8hcBc4C",73,53
"Старт ракеты: http://t.co/6skAQxDggE с помощью @YouTube",26,27
"проба как это работает с МКС",203,62
"Ну вот и день старта. Принял душ, обтёрся спиртом. Следующая возможность принять полноценный душ будет в ноябре. Старт будет в 23:57:41.",122,43
"@Msuraev @astro_reid @Astro_Alex это наше селфи с друзьями на пресс-конференции. http://t.co/ZWS2HGiIhd",222,226
"Гос. комиссия утвердила нас как основной экипаж. http://t.co/8ZMz2uvOKo",24,22
"@astro_reid and @Msuraev у нас крайние тренировки к невесомости. Остался день до старта. http://t.co/bJl3TmACel",15,18
"Это наше селфи на фоне одного двигателя 3-ей ступени. Через 4 дня она понесёт нас в космос. http://t.co/DP7E5KwnIs",105,128
"Вчера была посадка деревьев. Это очень хорошая традиция на Байконуре. http://t.co/kARGmV0IKO",57,44
"Пробежка на Байконуре для поддержания формы. 8 дней до старта. http://t.co/pBJbqMrBIk",17,20
"А это ребята которые помогают и сняли клип. Настоящие профи. http://t.co/it1wXAOwx1",14,10
"Есть проект который хотелось бы сделать в полёте, но только после одобрения начальства. Вот посмотрите http://t.co/yCfuownG6J",35,19
"Полностью готов к полёту в космос. http://t.co/h0Zk7LsVYF",28,35
"А это наша официальная эмблема. Смотри твит раньше. http://t.co/bYj5GSNBQY",66,50
"Это мы на Байконуре. http://t.co/Lg4ZWqz2iQ",55,55
"Дорогие друзья. Я на Байконуре. Скоро полёт в космос. Начинаю Твиттер. Буду держать вас в курсе.",243,71
"RT @Astro_Alex: 4.5 years ago I started astronaut training, today I finished it. #awesome @astro_reid @Msuraev #BlueDot",33,0
"RT @amicableru: С нами в эфире с @VorobievAndrey @Mosobl_TV наши друзья и соратники @nzlobin @Gorgadze_Shota @Msuraev @m_azarenkova http://…",15,0
"RT @olenka121: Воробьев набирает под 80% на выборах губернатора Подмосковья http://t.co/uvvDLKs5WN",3,0
"RT @amicableru: За честь работать с этим Человеком! #Воробьев http://t.co/0lV5OTdHyy",8,0
"Друзья, спасибо всем за вашу работу! Ждем официальных результатов!!",7,1
"RT @e_vysotskaya: Экзит от ВЦИОМа (на 16:00):Воробьёв - 72,5%, Черемисов - 9,9%, Гудков - 7,8%, Шингаркин - 3,1%, Корнеева - 3,0%, Романови…",9,0
"RT @IRodnina: @VorobievAndrey Искренние поздравление с убедительной победой и проделанной работой-люди поверили!Сил,здоровья,мудрости,мужес…",8,0
"RT @Mosobl_TV: Exit-Poll ВЦИОМ на 16:00: Черемисов — 9,9%, Гудков — 7,8%, Шингаркин — 3,1%, Корнеева — 3,0%, Романович — 2,1%.",8,0
"RT @er_mosobl: Жалоб из регионов на ход выборов в ЦИК РФ не поступало - http://t.co/qfVb8btnfx",1,0
"RT @EvgenyArsentyev: Единый день выборов в России завершается http://t.co/DenjABa7ho",1,0
"Космонавты, дважды Герои СССР и РФ Сергей Крикалев и Алексей Леонов. Объехали много участков, все было спокойно. http://t.co/KeZy8UCzux",10,8
"Пианист Александр Гиндин рассказывает о своей работе гражданского наблюдателя на #выборыМО http://t.co/VzplAiFhno",2,0
"RT @iskrastal1: Электросталь. Судьбоносный день для Подмосковья. Комментарий депутата Госдумы Юрия Липатова. http://t.co/YdoARkVOca",4,0
"RT @Mosobl_TV: Евгений Князев, ректор театр. института им.Щукина: 'Я рад, что в #Подмосковье проходят выборы. Меня огорчает явка, ожидал, ч…",7,0
"RT @e_vysotskaya: Князев: радуюсь, что проходят #ВыборыМО, что люди с большим воодушевлением хотят выбрать себе руководителя (ТК Подмосковь…",2,0
"RT @amicableru: “@Msuraev: Общ. наблюдатель Евгений Князев в эфире телеканала 'Подмосковье'. Ходом голосования доволен. #выборыМО http://t.…",7,0
"RT @Mosobl_TV: Геннадий Богачёв, руководитель пресс-службы ГУВД Московской области: выборы в #Подмосковье проходят в штатном режиме.",5,0
"RT @filipppaleev: г. Шатура на кождом ИУ не менее 5 наблюдателей. Много впервые голосующих, получали кепки, грамоты, конституцию! http://t.…",4,0
"RT @dvpestov: Эксперты-политологи: Московская область лидирует по уровню электорального доверия. http://t.co/fGqLc20mtp",6,0
"RT @e_vysotskaya: желание и задача провести #ВыборыМО чисто сплотили многих. Осталось 2 ч до закрытия участков, но уже сейчас можно говорит…",2,0
"Евгений Князев в эфире телеканала 'Подмосковье'. Ходом голосования доволен. #выборыМО http://t.co/LZkFiEE48r",3,1
"RT @belkai2010: #ВыборыМО Доверенное лицо #Воробьев'а Антон Цетков побывал на избирательных участках Можайского района.По его мнению процес…",6,0
"Сообщают, что в Звездном - явка 31%!",4,0
"Сергей Безруков на телеканале Подмосковье. #выборыМО http://t.co/Q9gY6VVV3n",1,0
"Егор Кончаловский рассказывает о дне в качестве наблюдателя на #выборыМО http://t.co/Q3Au4Q0yaV",4,1
"RT @amicableru: Общечивенный наблюдатель на #ВыборыМО  Егор Кончаловский на @Mosobl_TV  #ДеньВыборов http://t.co/aaIcsK4NS4",8,0
"RT @e_vysotskaya: В Звездном более 5 тыс избирателей, из них на #ВыборыМО многие голосуют впервые. Для них приготовили бейсболки, конституц…",2,0
"RT @praskovvia: Егор Кончаловский стал наблюдателем на выборах в Звенигороде #выборыМО http://t.co/SaZ1FsxBgX",8,0
"RT @e_vysotskaya: Неутомимая Валентина Кабанова добралась до Коломны. Несмотря на то, что везде спокойно, доверенные лица не хотят расслабл…",5,0
"RT @e_vysotskaya: Думала, что в Видном самые активные избиратели, но ИКМО сообщает, что самая высокая явка в Серебряных Прудах - 24% #Выбор…",1,0
"RT @e_vysotskaya: #ВыборыМО Зернов из пресс-центра ИКМО: В Долгопрудном оч. хотелось увидеть нарушения, но их не было...",3,0
"RT @Mosobl_TV: Владимир Зернов, ректор Российского нового университета о выборах в #Подмосковье: 'Бросается в глаза позитивный настрой, кот…",7,0
"Валентина Кабанова приехала в Коломну. Продолжает осмотр участков. Сообщает о полном соблюдении закона. #выборыМО",3,0
"RT @e_vysotskaya: Режиссер Егор Кончаловский посетил несколько участков в Звенигороде на #ВыборыМО http://t.co/rx6LpmZUrC",4,0
"RT @Mosobl_TV: В Звездном городке избирательные участки разместили в Доме космонавтов. http://t.co/MKIoVRmSwC #ВыборыМО",1,0
"RT @e_vysotskaya: Ближе к полудню жители городка активно потянулись на избирательные участки Звёздного, чтобы сделать свой выбор на #Выборы…",2,0
"Только что из Дуброво. Голосование идет хорошим ходом - военный городок голосует дисциплинированно и дружно. Высокая явка. #выборыМО",3,0
"RT @Mosobl_TV: В #Дубне на одном из избирательных участков можно не только проголосовать, но и померить давление и узнать свой уровень саха…",6,0
"RT @G_SpaceSystems: Н.Н.Севастьянов посетил 21 #УИК : #Щелковскийрайон 3413-3415, 3449-3450, #Королев 1066-1073, 1079, 1081, 1107-1111. htt…",4,0
"Галина Маланичева сообщает из Котельников, что все в порядке и в рамках закона #выборыМО",1,0
"Андрей Тамонов рассказывает о голосовании в Дубне и области #выборыМО http://t.co/xpAbKjq9Q1",1,0
"Виктор Санаев рассказывает о своих впечатлениях после посещения избирательных участков на #выборыМО на телевидении 'Подмосковье'",7,0
"RT @e_vysotskaya: Судя по фото @EvgenyArsentyev, явка в Видном выше, чем в остальных муниципалитетах",3,0
"RT @e_vysotskaya: про комфортную среду в #НашеПодмосковье: в Подольске люди с ограниченными возможностями получили  удобные участки для гол…",4,0
"RT @info_mo2013: Явка (уточненные данные) проголосовало - 10,46%,  568 366 избирателей.",8,0
"RT @e_vysotskaya: #ВыборыМО Нармин Ширалиева недалеко от Истры. Она проверит работу и процесс на УИКах в педагогическом колледже, клубе 'Ис…",2,0
"Николай Громов объехал 10 участков в Подольске. Нарушений нет. #выборыМО",1,0
"Антон Цветков осмотрел участки в Можайске и Можайском районе и Бородино. Как и ожидалось - все в порядке. #выборыМО",4,0
"Дмирий Саблин проголосовал в Реутово. Поехал в Пушкино наблюдать за голосованием. Закон соблюдается везде. #выборыМО",6,0
"RT @e_vysotskaya: Ирина Константиновна Роднина подъезжает к УИКу в с/ш Можайска №1 (это на ул.Московской). Встречайте! #ВыборыМО",2,0
"RT @e_vysotskaya: #ВыборыМО На телефон 'горячих линий' поступают звонки: нарушения не подтвердились (Секретарь ИКМО)",2,0
"Юрий Липатов побывал на участках в Электростале. Сообщает о том, что все в рамках закона. #выборыМО",6,1
"Сейчас еду в Дуброво. Там военный городок, голосуют там тоже дружно и массово.",2,0
"Был на участке в Ногинске в школе #5. Очень хорошо все и дружно. Много голосует людей.",5,0
"RT @EvgenyArsentyev: #Видное Участок 1276. Очень большая явка. Нарушений нет. Голосование проходит спокойно. #ВыборыМО http://t.co/DKY5qvQZ…",12,0
"@Msuraev: Из-за визита Безрукова на участок, выборы в Видном приостановились для коллективного фото:)) #выборыМО http://t.co/b6Q51qWe5f",22,0
"RT @s_bezrukov: Я понимаю, что «позитив» тоже раздражает, особенно, когда его много. Поэтому я промолчу!))))",76,0
"Сергей Безруков и Евгений Арсентьев в Видном. #выборыМО http://t.co/32Gowv3KYc",8,3
"RT @amicableru: #ВыборыМО В регионе работают две 'горячие линии' Мособлизбиркома. (495) 606-00-06 - для выборов губернатора (495) 606-07-42…",48,0
"RT @e_vysotskaya: наблюдатели от Общественной палаты сообщают, что обстановка на всех без исключения участках, где они побывали, спокойная …",5,0
"RT @e_vysotskaya: на #ВыборыМО голосуют семьями",1,0
"RT @izasakharovu: На УИК 3148/3149 в #Химки многолюдно,видна большая гражданская активность населения,люди приходят семьями #выборыМО http:…",4,0
"RT @e_vysotskaya: говорят, что звёзд на УИКах не узнают )) Ув.избиратели, за #ВыборыМО наблюдают настоящие звёзды, депутаты, политологи и о…",2,0
